{
  "$schema": "../schemas/runner.schema.json",
  "name": "codex",
  "displayName": "OpenAI Codex CLI",
  "binary": "codex",
  "tier": "tested",
  "installHint": "npm install -g @openai/codex",
  "version": ">=0.118.0",
  "invocation": {
    "promptDelivery": "positional",
    "promptFlag": null,
    "headlessFlags": [
      "-q"
    ],
    "autoApproveFlags": [
      "--approval-mode",
      "full-auto"
    ],
    "outputFlags": [],
    "extraFlags": [],
    "stdinPipe": false
  },
  "instructionFile": {
    "native": "AGENTS.md",
    "fallbackFrom": "CLAUDE.md",
    "autoGenerate": true
  },
  "signals": {
    "preambleInjection": true,
    "heuristicFallback": true
  },
  "quirks": {
    "sandboxBlocksNetwork": true,
    "noExplicitCwd": true,
    "notes": "Codex runs in a sandboxed environment that blocks network access in full-auto mode. Ensure all dependencies are pre-installed before running."
  }
}
