{
  "name": "aider",
  "displayName": "Aider",
  "binary": "aider",
  "tier": "experimental",
  "installHint": "pip install aider-chat",
  "version": ">=0.50.0",
  "invocation": {
    "promptDelivery": "flag",
    "promptFlag": "-m",
    "headlessFlags": ["--yes-always"],
    "autoApproveFlags": [],
    "outputFlags": [],
    "extraFlags": [],
    "stdinPipe": false
  },
  "instructionFile": {
    "native": "CLAUDE.md",
    "fallbackFrom": null,
    "autoGenerate": false
  },
  "signals": {
    "preambleInjection": true,
    "heuristicFallback": true
  },
  "quirks": {
    "noMcp": true,
    "notes": "Aider does not support MCP tools."
  }
}
