{
  "$schema": "../schemas/runner.schema.json",
  "name": "cursor",
  "displayName": "Cursor Agent",
  "binary": "agent",
  "tier": "experimental",
  "installHint": "Install Cursor from https://cursor.sh",
  "version": ">=0.50.0",
  "invocation": {
    "promptDelivery": "flag",
    "promptFlag": "-p",
    "headlessFlags": [],
    "autoApproveFlags": [
      "--force"
    ],
    "outputFlags": [],
    "extraFlags": [],
    "stdinPipe": false
  },
  "instructionFile": {
    "native": "AGENTS.md",
    "fallbackFrom": "CLAUDE.md",
    "autoGenerate": true
  },
  "signals": {
    "preambleInjection": true,
    "heuristicFallback": true
  },
  "quirks": {
    "betaHangingBug": true,
    "staleTimeoutOverride": 10,
    "notes": "Cursor agent may hang on certain prompts. Use shorter stale timeout."
  }
}
