{
  "name": "amp",
  "displayName": "Amp CLI",
  "binary": "amp",
  "tier": "experimental",
  "installHint": "npm install -g @anthropic-ai/amp",
  "version": ">=0.1.0",
  "invocation": {
    "promptDelivery": "stdin",
    "promptFlag": null,
    "headlessFlags": [],
    "autoApproveFlags": ["--dangerously-allow-all"],
    "outputFlags": [],
    "extraFlags": [],
    "stdinPipe": true
  },
  "instructionFile": {
    "native": "AGENTS.md",
    "fallbackFrom": "CLAUDE.md",
    "autoGenerate": true
  },
  "signals": {
    "preambleInjection": true,
    "heuristicFallback": true
  },
  "quirks": {}
}
